{
  "profile_id": "sagemcom_homebox_hgw4ac",
  "brand": "Sagemcom",
  "model": "HomeBox HGW4ac",
  "hardware_versions": [
    "Yousee"
  ],
  "firmware_range": {
    "min": null,
    "max": null
  },
  "profile_version": 1,
  "profile_hash": "fc86da5aab3db58a81e307ec6e612c4d62d52de69997726ba7b1e3c3a6615d4d",
  "last_updated": "2026-10-28",
  "status": "community",
  "oui_prefixes": [],
  "http_fingerprints": [],
  "default_gateway_paths": [
    "/"
  ],
  "driver_type": "web",
  "admin_url": "http://{gateway}/",
  "login_method": "form login",
  "ports": [
    80,
    443
  ],
  "default_credentials_ref": "Vendor factory defaults — see vendor manual",
  "supported_controls": [],
  "unsupported_controls": [
    "router_info",
    "wifi_ssid_24",
    "wifi_ssid_5",
    "wifi_password",
    "wifi_band_enable",
    "guest_wifi",
    "connected_devices",
    "device_block",
    "reboot",
    "wifi_channel",
    "wifi_security_view",
    "admin_password",
    "firmware_check"
  ],
  "tested_on": "",
  "tested_by": "",
  "test_result": {
    "driver": "pending",
    "controls": "not_tested"
  },
  "known_issues": [
    "Registration-only entry. The model is known to the Library, but its driver is still pending, so no controls are available yet.",
    "Source: WikiDevi 2019 snapshot — back-catalog data, stale for post-2019 models, verify before any driver work"
  ],
  "signature": "iBVRkx7GYxQXDbVCZxUWZ2Hi1DZmIECdruBhKmSn42j8Kd7xrUSqWIk9VaaIbiQyxgRNOhD/f7/O4ndUBZegAg=="
}
