{
  "profile_id": "edimax_ew_7416apn",
  "brand": "Edimax",
  "model": "EW-7416APn",
  "hardware_versions": [
    "unspecified"
  ],
  "firmware_range": {
    "min": null,
    "max": null
  },
  "profile_version": 1,
  "profile_hash": "6074846d61803627c923360709aa9bbde50c877255fcfe3ae993e4c5224bd407",
  "last_updated": "2026-10-28",
  "status": "community",
  "oui_prefixes": [],
  "http_fingerprints": [],
  "default_gateway_paths": [
    "/"
  ],
  "driver_type": "web",
  "admin_url": "http://{gateway}/",
  "login_method": "form login",
  "ports": [
    80,
    443
  ],
  "default_credentials_ref": "Vendor factory defaults — see vendor manual",
  "supported_controls": [],
  "unsupported_controls": [
    "router_info",
    "wifi_ssid_24",
    "wifi_ssid_5",
    "wifi_password",
    "wifi_band_enable",
    "guest_wifi",
    "connected_devices",
    "device_block",
    "reboot",
    "wifi_channel",
    "wifi_security_view",
    "admin_password",
    "firmware_check"
  ],
  "tested_on": "",
  "tested_by": "",
  "test_result": {
    "driver": "pending",
    "controls": "not_tested"
  },
  "known_issues": [
    "Registration-only entry. The model is known to the Library, but its driver is still pending, so no controls are available yet.",
    "Source: WikiDevi 2019 snapshot — back-catalog data, stale for post-2019 models, verify before any driver work",
    "DeviWiki live: brand/model from page title (category: wireless); manufacturer on page: Edimax; Manuf product model not stated.",
    "Source: DeviWiki live (deviwiki.com Special:Ask, fetched 2026-10-28). FCC ID: NDD9574160804; CPU: RT2880; Wi-Fi chip: RT2880"
  ],
  "signature": "SD/5PFMiO7ujfvHlqR5RVYUCliR6brrAvNpvynUD3yLGwZ8+rsLVHOdAFUEdCNjMZrNV8OYL3S1xyn3I0dcMAA=="
}
