{
  "profile_id": "d_link_dap_1360_rev_b1",
  "brand": "D-Link",
  "model": "DAP-1360 rev B1",
  "hardware_versions": [
    "unspecified"
  ],
  "firmware_range": {
    "min": null,
    "max": null
  },
  "profile_version": 1,
  "profile_hash": "d66491afb9b9db4d9513dc2bb0870a5790646bced5f08331f1536459a6cf555e",
  "last_updated": "2026-10-28",
  "status": "community",
  "oui_prefixes": [
    "00:05:5d",
    "00:15:e9",
    "00:19:5b",
    "14:d6:4d",
    "1c:7e:e5",
    "f0:7d:68"
  ],
  "http_fingerprints": [],
  "default_gateway_paths": [
    "/"
  ],
  "driver_type": "web",
  "admin_url": "http://{gateway}/",
  "login_method": "form login",
  "ports": [
    80,
    443
  ],
  "default_credentials_ref": "Vendor factory defaults — see vendor manual",
  "supported_controls": [],
  "unsupported_controls": [
    "router_info",
    "wifi_ssid_24",
    "wifi_ssid_5",
    "wifi_password",
    "wifi_band_enable",
    "guest_wifi",
    "connected_devices",
    "device_block",
    "reboot",
    "wifi_channel",
    "wifi_security_view",
    "admin_password",
    "firmware_check"
  ],
  "tested_on": "",
  "tested_by": "",
  "test_result": {
    "driver": "pending",
    "controls": "not_tested"
  },
  "known_issues": [
    "Registration-only entry. The model is known to the Library, but its driver is still pending, so no controls are available yet.",
    "DeviWiki live: brand/model from page title (category: wireless); manufacturer on page: Cameo; Manuf product model not stated.",
    "Source: DeviWiki live (deviwiki.com Special:Ask, fetched 2026-10-28). FCC ID: KA2AP1360B1; year: 2010; CPU: RTL8196B"
  ],
  "signature": "hTx7ZeNKPj+1WJXYVgiuNmRG+7VxPxm73jijU9LDLXqcKpsiv78/v/HQtGQptMwLtPEsWqCf02W1iNetH3vsBQ=="
}
