{
  "profile_id": "askey_cme090w_d17",
  "brand": "Askey",
  "model": "CME090W-D17",
  "hardware_versions": [
    "unspecified"
  ],
  "firmware_range": {
    "min": null,
    "max": null
  },
  "profile_version": 1,
  "profile_hash": "7079d6633b11252d2b75fe186261b2ae8e3aabfd03f560e7082ed8a55ed0063f",
  "last_updated": "2026-10-28",
  "status": "community",
  "oui_prefixes": [],
  "http_fingerprints": [],
  "default_gateway_paths": [
    "/"
  ],
  "driver_type": "web",
  "admin_url": "http://{gateway}/",
  "login_method": "form login",
  "ports": [
    80,
    443
  ],
  "default_credentials_ref": "Vendor factory defaults — see vendor manual",
  "supported_controls": [],
  "unsupported_controls": [
    "router_info",
    "wifi_ssid_24",
    "wifi_ssid_5",
    "wifi_password",
    "wifi_band_enable",
    "guest_wifi",
    "connected_devices",
    "device_block",
    "reboot",
    "wifi_channel",
    "wifi_security_view",
    "admin_password",
    "firmware_check"
  ],
  "tested_on": "",
  "tested_by": "",
  "test_result": {
    "driver": "pending",
    "controls": "not_tested"
  },
  "known_issues": [
    "Registration-only entry. The model is known to the Library, but its driver is still pending, so no controls are available yet.",
    "Source: DeviWiki live (deviwiki.com Special:Ask, fetched 2026-10-28). FCC ID: H8N-DPR362; year: 2002; CPU: BCM3360"
  ],
  "signature": "DJg++3CAj7u1zg8/Fk90PQ+nVq6IzOKRD9o9LDUulL+GwbcoKksWyNo78hoA2EwP3Qlj7kQbqSlrfDQl/WH6Cg=="
}
