{
  "profile_id": "tp_link_tl_wr743nd_v1_1",
  "brand": "TP-Link",
  "model": "TL-WR743ND v1.1",
  "hardware_versions": [
    "unspecified"
  ],
  "firmware_range": {
    "min": null,
    "max": null
  },
  "profile_version": 1,
  "profile_hash": "01def62e4b6a7c7a10fc376da859605decf93df9bb740a24426aa4bef2da6149",
  "last_updated": "2026-10-28",
  "status": "community",
  "oui_prefixes": [
    "74:ea:3a"
  ],
  "http_fingerprints": [],
  "default_gateway_paths": [
    "/"
  ],
  "driver_type": "web",
  "admin_url": "http://{gateway}/",
  "login_method": "form login",
  "ports": [
    80,
    443
  ],
  "default_credentials_ref": "Vendor factory defaults — see vendor manual",
  "supported_controls": [],
  "unsupported_controls": [
    "router_info",
    "wifi_ssid_24",
    "wifi_ssid_5",
    "wifi_password",
    "wifi_band_enable",
    "guest_wifi",
    "connected_devices",
    "device_block",
    "reboot",
    "wifi_channel",
    "wifi_security_view",
    "admin_password",
    "firmware_check"
  ],
  "tested_on": "",
  "tested_by": "",
  "test_result": {
    "driver": "pending",
    "controls": "not_tested"
  },
  "known_issues": [
    "Registration-only entry. The model is known to the Library, but its driver is still pending, so no controls are available yet.",
    "DeviWiki live: brand/model from page title (category: wireless); manufacturer unproven (no manufacturer property).",
    "Source: DeviWiki live (deviwiki.com Special:Ask, fetched 2026-10-28). FCC ID: TE7WR743ND; CPU: AR7240; Wi-Fi chip: AR9285"
  ],
  "signature": "IJqZDQPP327N83jhZfxngvcfEX/TSVQ1VIRoTFHGu4HRXCmF5hJJ9QnKfzLgHVw5L0fIbSBSF4serQrCoAuyBw=="
}
