{
  "profile_id": "mikrotik_routerboard_wap_60g",
  "brand": "MikroTik",
  "model": "RouterBOARD wAP 60G",
  "hardware_versions": [
    "(RBwAPG-60ad)"
  ],
  "firmware_range": {
    "min": null,
    "max": null
  },
  "profile_version": 1,
  "profile_hash": "3f4b10dab2c297b9a6f81ff75723c369e560785c0ce67fafa650779afb9beac2",
  "last_updated": "2026-10-28",
  "status": "community",
  "oui_prefixes": [
    "00:0c:42",
    "2c:c8:1b",
    "64:d1:54",
    "78:9a:18",
    "cc:2d:e0",
    "e4:8d:8c"
  ],
  "http_fingerprints": [],
  "default_gateway_paths": [
    "/"
  ],
  "driver_type": "web",
  "admin_url": "http://{gateway}/",
  "login_method": "form login",
  "ports": [
    80,
    443
  ],
  "default_credentials_ref": "Vendor factory defaults — see vendor manual",
  "supported_controls": [],
  "unsupported_controls": [
    "router_info",
    "wifi_ssid_24",
    "wifi_ssid_5",
    "wifi_password",
    "wifi_band_enable",
    "guest_wifi",
    "connected_devices",
    "device_block",
    "reboot",
    "wifi_channel",
    "wifi_security_view",
    "admin_password",
    "firmware_check"
  ],
  "tested_on": "",
  "tested_by": "",
  "test_result": {
    "driver": "pending",
    "controls": "not_tested"
  },
  "known_issues": [
    "Registration-only entry. The model is known to the Library, but its driver is still pending, so no controls are available yet.",
    "Source: WikiDevi 2019 snapshot — back-catalog data, stale for post-2019 models, verify before any driver work"
  ],
  "signature": "Vh9Wx3pSzfFniKvzit1ObDI8e2OdJv3wLjernQAbTWzsRLi4bNsaHuHFEDYKf3EkR899vVFqQM14gPmwmd+XDQ=="
}
