{
  "profile_id": "accton_wg3005b_1_17",
  "brand": "Accton",
  "model": "WG3005B 1-17",
  "hardware_versions": [
    "unspecified"
  ],
  "firmware_range": {
    "min": null,
    "max": null
  },
  "profile_version": 1,
  "profile_hash": "f29b3b2729569464ff61b5c517ac89a8a7cd03e61f50689630b673354b79d5f4",
  "last_updated": "2026-10-28",
  "status": "community",
  "oui_prefixes": [
    "00:04:e2"
  ],
  "http_fingerprints": [],
  "default_gateway_paths": [
    "/"
  ],
  "driver_type": "web",
  "admin_url": "http://{gateway}/",
  "login_method": "form login",
  "ports": [
    80,
    443
  ],
  "default_credentials_ref": "Vendor factory defaults — see vendor manual",
  "supported_controls": [],
  "unsupported_controls": [
    "router_info",
    "wifi_ssid_24",
    "wifi_ssid_5",
    "wifi_password",
    "wifi_band_enable",
    "guest_wifi",
    "connected_devices",
    "device_block",
    "reboot",
    "wifi_channel",
    "wifi_security_view",
    "admin_password",
    "firmware_check"
  ],
  "tested_on": "",
  "tested_by": "",
  "test_result": {
    "driver": "pending",
    "controls": "not_tested"
  },
  "known_issues": [
    "Registration-only entry. The model is known to the Library, but its driver is still pending, so no controls are available yet.",
    "Source: WikiDevi 2019 snapshot — back-catalog data, stale for post-2019 models, verify before any driver work",
    "DeviWiki live: brand/model from page title (category: wireless); manufacturer on page: Accton; Manuf product model not stated.",
    "Source: DeviWiki live (deviwiki.com Special:Ask, fetched 2026-10-28). FCC ID: HEDWG3005B1-17; year: 2002; CPU: ADM5106; Wi-Fi chip: AT76C502A",
    "Source: DeviWiki live (deviwiki.com Special:Ask, fetched 2026-10-28). FCC ID: HEDACC2632WV2, HEDWG3005B1-17; year: 2002; CPU: CX84200-11; Wi-Fi chip: AT76C502A"
  ],
  "signature": "k2Wt69x43OsbJqpC4SzF6JTzj7CBlJVmDNhVlcsb+lsdTiPulyDxO3TyQi+mgdW1ajiS746G7YS3bpndJaUdCg=="
}
