{
  "profile_id": "paypal_beacon_dcbnee01",
  "brand": "PayPal",
  "model": "Beacon (DCBNEE01)",
  "hardware_versions": [
    "unspecified"
  ],
  "firmware_range": {
    "min": null,
    "max": null
  },
  "profile_version": 1,
  "profile_hash": "91546bfdf9a2e9b175dc578a82594ac6f2cbfb67ea189b8431c23b4b005e14af",
  "last_updated": "2026-10-28",
  "status": "community",
  "oui_prefixes": [],
  "http_fingerprints": [],
  "default_gateway_paths": [
    "/"
  ],
  "driver_type": "web",
  "admin_url": "http://{gateway}/",
  "login_method": "form login",
  "ports": [
    80,
    443
  ],
  "default_credentials_ref": "Vendor factory defaults — see vendor manual",
  "supported_controls": [],
  "unsupported_controls": [
    "router_info",
    "wifi_ssid_24",
    "wifi_ssid_5",
    "wifi_password",
    "wifi_band_enable",
    "guest_wifi",
    "connected_devices",
    "device_block",
    "reboot",
    "wifi_channel",
    "wifi_security_view",
    "admin_password",
    "firmware_check"
  ],
  "tested_on": "",
  "tested_by": "",
  "test_result": {
    "driver": "pending",
    "controls": "not_tested"
  },
  "known_issues": [
    "Registration-only entry. The model is known to the Library, but its driver is still pending, so no controls are available yet.",
    "DeviWiki live: brand/model from page title (category: wireless); manufacturer unproven (no manufacturer property).",
    "Source: DeviWiki live (deviwiki.com Special:Ask, fetched 2026-10-28). FCC ID: 2AB8CDCBNEE01; year: 2014"
  ],
  "signature": "OZjoLRGWLrrF57Ql8tWnqMI56hvqkA2cDVhxhhx/fNMQbiZCbK+ZD0q73KJj7fT2QEIH1w+Os8YaFyQXfOrvBA=="
}
