{
  "profile_id": "sparklan_ep_6800",
  "brand": "SparkLAN",
  "model": "EP-6800",
  "hardware_versions": [
    "unspecified"
  ],
  "firmware_range": {
    "min": null,
    "max": null
  },
  "profile_version": 1,
  "profile_hash": "b7fb558c00fcb4dc6af7e1cd8773bd370b82ae9d17050adcd6dfdb26cb1d7d3a",
  "last_updated": "2026-10-28",
  "status": "community",
  "oui_prefixes": [
    "00:14:a5"
  ],
  "http_fingerprints": [],
  "default_gateway_paths": [
    "/"
  ],
  "driver_type": "web",
  "admin_url": "http://{gateway}/",
  "login_method": "form login",
  "ports": [
    80,
    443
  ],
  "default_credentials_ref": "Vendor factory defaults — see vendor manual",
  "supported_controls": [],
  "unsupported_controls": [
    "router_info",
    "wifi_ssid_24",
    "wifi_ssid_5",
    "wifi_password",
    "wifi_band_enable",
    "guest_wifi",
    "connected_devices",
    "device_block",
    "reboot",
    "wifi_channel",
    "wifi_security_view",
    "admin_password",
    "firmware_check"
  ],
  "tested_on": "",
  "tested_by": "",
  "test_result": {
    "driver": "pending",
    "controls": "not_tested"
  },
  "known_issues": [
    "Registration-only entry. The model is known to the Library, but its driver is still pending, so no controls are available yet.",
    "Source: WikiDevi 2019 snapshot — back-catalog data, stale for post-2019 models, verify before any driver work",
    "Source: DeviWiki live (deviwiki.com Special:Ask, fetched 2026-10-28). FCC ID: MXF-HAP930819G; CPU: BCM4712; Wi-Fi chip: BCM4712",
    "Rebrand — manufacturer proven, admin surface unproven. Display brand/model SparkLAN EP-6800; manufacturer Gemtek WHAPC-100GE (DeviWiki live)."
  ],
  "signature": "J1Wq7y3pTYihpAJy46T2kDazbsXS+EZrzVILEW90e7Y1zg2dYS9puQQFdJ/Po496gGR1KBUjPkfxQ3vhEmDhBA=="
}
