{
  "profile_id": "shenzhen_gongjin_electronics_gaw9_2z18_4",
  "brand": "Shenzhen Gongjin Electronics",
  "model": "Gaw9.2Z18-4",
  "hardware_versions": [
    "unspecified"
  ],
  "firmware_range": {
    "min": null,
    "max": null
  },
  "profile_version": 1,
  "profile_hash": "134bd43312e30f2482d5a972543cfb0ff7aab5ea1c21fe9aff4ab6984400d579",
  "last_updated": "2026-10-28",
  "status": "community",
  "oui_prefixes": [],
  "http_fingerprints": [],
  "default_gateway_paths": [
    "/"
  ],
  "driver_type": "web",
  "admin_url": "http://{gateway}/",
  "login_method": "form login",
  "ports": [
    80,
    443
  ],
  "default_credentials_ref": "Vendor factory defaults — see vendor manual",
  "supported_controls": [],
  "unsupported_controls": [
    "router_info",
    "wifi_ssid_24",
    "wifi_ssid_5",
    "wifi_password",
    "wifi_band_enable",
    "guest_wifi",
    "connected_devices",
    "device_block",
    "reboot",
    "wifi_channel",
    "wifi_security_view",
    "admin_password",
    "firmware_check"
  ],
  "tested_on": "",
  "tested_by": "",
  "test_result": {
    "driver": "pending",
    "controls": "not_tested"
  },
  "known_issues": [
    "Registration-only entry. The model is known to the Library, but its driver is still pending, so no controls are available yet.",
    "DeviWiki live: manufacturer model Shenzhen Gongjin Electronics Gaw9.2Z18-4; FCC ID matches Kozumi KM410WG — same hardware family, name variant.",
    "Source: DeviWiki live (deviwiki.com Special:Ask, fetched 2026-10-28). FCC ID: V4VGAW92Z18-4; year: 2008; CPU: RTL8671P; Wi-Fi chip: RTL8185B",
    "DeviWiki live: brand/model from page title (category: wireless); manufacturer on page: Shenzhen Gongjin Electronics; Manuf product model not stated."
  ],
  "signature": "VpEY8WUapuzPK0G8SOL/K4XrWe/bXISN2R6SH0PSScxrAx0HxHlI1kcem0Ti5nkwPNszn5f+OKdJW8wsaAN0Dw=="
}
