{
  "profile_id": "alpha_networks_wus_n04",
  "brand": "Alpha Networks",
  "model": "WUS-N04",
  "hardware_versions": [
    "unspecified"
  ],
  "firmware_range": {
    "min": null,
    "max": null
  },
  "profile_version": 1,
  "profile_hash": "b15210c470bf01ce752dc610f5fee4a71f14029f8b041ccdfbf3b199d27837b2",
  "last_updated": "2026-10-28",
  "status": "community",
  "oui_prefixes": [
    "00:1d:6a"
  ],
  "http_fingerprints": [],
  "default_gateway_paths": [
    "/"
  ],
  "driver_type": "web",
  "admin_url": "http://{gateway}/",
  "login_method": "form login",
  "ports": [
    80,
    443
  ],
  "default_credentials_ref": "Vendor factory defaults — see vendor manual",
  "supported_controls": [],
  "unsupported_controls": [
    "router_info",
    "wifi_ssid_24",
    "wifi_ssid_5",
    "wifi_password",
    "wifi_band_enable",
    "guest_wifi",
    "connected_devices",
    "device_block",
    "reboot",
    "wifi_channel",
    "wifi_security_view",
    "admin_password",
    "firmware_check"
  ],
  "tested_on": "",
  "tested_by": "",
  "test_result": {
    "driver": "pending",
    "controls": "not_tested"
  },
  "known_issues": [
    "Registration-only entry. The model is known to the Library, but its driver is still pending, so no controls are available yet.",
    "Source: DeviWiki live (deviwiki.com Special:Ask, fetched 2026-10-28); year: 2008"
  ],
  "signature": "ss60qqfGVHx9jvJ9RtEHZjYX1xjQYIyNqdn+PXIUxtU3Up6rGhJyzBjLFHpLDEz3n/G4hu3MW3vu3oNOJhfmAg=="
}
