{
  "profile_id": "verizon_vre3000",
  "brand": "Verizon",
  "model": "VRE3000",
  "hardware_versions": [
    "unspecified"
  ],
  "firmware_range": {
    "min": null,
    "max": null
  },
  "profile_version": 1,
  "profile_hash": "5d88b4d04efc4385ec085cf01010dcdba11c3e283e35b70d8c1a4507bee581d3",
  "last_updated": "2026-10-28",
  "status": "community",
  "oui_prefixes": [
    "00:11:e0"
  ],
  "http_fingerprints": [],
  "default_gateway_paths": [
    "/"
  ],
  "driver_type": "web",
  "admin_url": "http://{gateway}/",
  "login_method": "form login",
  "ports": [
    80,
    443
  ],
  "default_credentials_ref": "Vendor factory defaults — see vendor manual",
  "supported_controls": [],
  "unsupported_controls": [
    "router_info",
    "wifi_ssid_24",
    "wifi_ssid_5",
    "wifi_password",
    "wifi_band_enable",
    "guest_wifi",
    "connected_devices",
    "device_block",
    "reboot",
    "wifi_channel",
    "wifi_security_view",
    "admin_password",
    "firmware_check"
  ],
  "tested_on": "",
  "tested_by": "",
  "test_result": {
    "driver": "pending",
    "controls": "not_tested"
  },
  "known_issues": [
    "Registration-only entry. The model is known to the Library, but its driver is still pending, so no controls are available yet.",
    "Source: WikiDevi 2019 snapshot — back-catalog data, stale for post-2019 models, verify before any driver work",
    "DeviWiki live: brand/model from page title (category: wireless); manufacturer on page: U-MEDIA; Manuf product model not stated.",
    "Source: DeviWiki live (deviwiki.com Special:Ask, fetched 2026-10-28). FCC ID: SI5VRE3000; year: 2018; CPU: MT7621AT; Wi-Fi chip: MT7615DN"
  ],
  "signature": "sWnwxDxVL5RopybD+/CXy9TLgTjct8ODggsGiiyHpL6xlPCcfre4KaoTZMrkcLOzDJVPCv2pL0WXIbP9pLWkCQ=="
}
