{
  "profile_id": "netgear_wndr4500v1",
  "brand": "Netgear",
  "model": "WNDR4500v1",
  "hardware_versions": [
    "unspecified"
  ],
  "firmware_range": {
    "min": null,
    "max": null
  },
  "profile_version": 1,
  "profile_hash": "91533658453ba3c20ff0873f9339451a5eee946b91b9952e94bace205c8fae5d",
  "last_updated": "2026-10-28",
  "status": "community",
  "oui_prefixes": [
    "20:4e:7f",
    "74:44:01",
    "84:1b:5e",
    "e0:46:9a"
  ],
  "http_fingerprints": [],
  "default_gateway_paths": [
    "/"
  ],
  "driver_type": "web",
  "admin_url": "http://{gateway}/",
  "login_method": "form login",
  "ports": [
    80,
    443
  ],
  "default_credentials_ref": "Vendor factory defaults — see vendor manual",
  "supported_controls": [],
  "unsupported_controls": [
    "router_info",
    "wifi_ssid_24",
    "wifi_ssid_5",
    "wifi_password",
    "wifi_band_enable",
    "guest_wifi",
    "connected_devices",
    "device_block",
    "reboot",
    "wifi_channel",
    "wifi_security_view",
    "admin_password",
    "firmware_check"
  ],
  "tested_on": "",
  "tested_by": "",
  "test_result": {
    "driver": "pending",
    "controls": "not_tested"
  },
  "known_issues": [
    "Registration-only entry. The model is known to the Library, but its driver is still pending, so no controls are available yet.",
    "Rebrand — manufacturer proven, admin surface unproven. Display brand/model Netgear WNDR4500v1; manufacturer Foxconn U12H189 (DeviWiki live).",
    "Source: DeviWiki live (deviwiki.com Special:Ask, fetched 2026-10-28). FCC ID: PY311200162; year: 2011; CPU: BCM4706; Wi-Fi chip: BCM4331"
  ],
  "signature": "2WWCn1nZQL1cMjF9MIYbCBYI2KenA2a7EIbYdckyihlb6+TVwnOq+9CUQdAPCLHHBDRmDvADIdklU8jmSsovDg=="
}
