{
  "profile_id": "jcg_jwa_2018r",
  "brand": "JCG",
  "model": "JWA-2018R",
  "hardware_versions": [
    "unspecified"
  ],
  "firmware_range": {
    "min": null,
    "max": null
  },
  "profile_version": 1,
  "profile_hash": "8d655281590404e63bf5b2c19aab4a6929e388f5847cdba1de7a96628fafe45f",
  "last_updated": "2026-10-28",
  "status": "community",
  "oui_prefixes": [],
  "http_fingerprints": [],
  "default_gateway_paths": [
    "/"
  ],
  "driver_type": "web",
  "admin_url": "http://{gateway}/",
  "login_method": "form login",
  "ports": [
    80,
    443
  ],
  "default_credentials_ref": "Vendor factory defaults — see vendor manual",
  "supported_controls": [],
  "unsupported_controls": [
    "router_info",
    "wifi_ssid_24",
    "wifi_ssid_5",
    "wifi_password",
    "wifi_band_enable",
    "guest_wifi",
    "connected_devices",
    "device_block",
    "reboot",
    "wifi_channel",
    "wifi_security_view",
    "admin_password",
    "firmware_check"
  ],
  "tested_on": "",
  "tested_by": "",
  "test_result": {
    "driver": "pending",
    "controls": "not_tested"
  },
  "known_issues": [
    "Registration-only entry. The model is known to the Library, but its driver is still pending, so no controls are available yet.",
    "Source: WikiDevi 2019 snapshot — back-catalog data, stale for post-2019 models, verify before any driver work",
    "DeviWiki live: brand/model from page title (category: wireless); manufacturer on page: Shenzhen Yichen Technology; Manuf product model not stated.",
    "Source: DeviWiki live (deviwiki.com Special:Ask, fetched 2026-10-28). FCC ID: HHOJWA-2018R; year: 2013; CPU: RT5350; Wi-Fi chip: RT5350"
  ],
  "signature": "pEprr7nQ5ls+LFvYVopacBrlsNSSlmwpjgDnvQHlPEkscnJomYB+tw77vZPQQ5wPHZ8VPQm5VuTBjdzuTck4AQ=="
}
