{
  "profile_id": "conceptronic_c300ru_v1",
  "brand": "Conceptronic",
  "model": "C300RU v1",
  "hardware_versions": [
    "unspecified"
  ],
  "firmware_range": {
    "min": null,
    "max": null
  },
  "profile_version": 1,
  "profile_hash": "8daa65e6bf4a222ab2f617d81cfd56dd12fd9bc72db237963bb7304d07593f92",
  "last_updated": "2026-10-28",
  "status": "community",
  "oui_prefixes": [],
  "http_fingerprints": [],
  "default_gateway_paths": [
    "/"
  ],
  "driver_type": "web",
  "admin_url": "http://{gateway}/",
  "login_method": "form login",
  "ports": [
    80,
    443
  ],
  "default_credentials_ref": "Vendor factory defaults — see vendor manual",
  "supported_controls": [],
  "unsupported_controls": [
    "router_info",
    "wifi_ssid_24",
    "wifi_ssid_5",
    "wifi_password",
    "wifi_band_enable",
    "guest_wifi",
    "connected_devices",
    "device_block",
    "reboot",
    "wifi_channel",
    "wifi_security_view",
    "admin_password",
    "firmware_check"
  ],
  "tested_on": "",
  "tested_by": "",
  "test_result": {
    "driver": "pending",
    "controls": "not_tested"
  },
  "known_issues": [
    "Registration-only entry. The model is known to the Library, but its driver is still pending, so no controls are available yet.",
    "Rebrand — manufacturer proven, admin surface unproven. Display brand/model Conceptronic C300RU v1; manufacturer Alpha Networks WUS-N02 (DeviWiki live).",
    "Source: DeviWiki live (deviwiki.com Special:Ask, fetched 2026-10-28); year: 2007"
  ],
  "signature": "3V3d03ZabwHQRkFs712kOYr+TXenZnKYf/vV6u1jtrTD1sqgA5JqsqHYKim52PCM1sVsNJmNwfDhabLCJwSsDw=="
}
