{
  "profile_id": "data_alliance_cu9",
  "brand": "Data-Alliance",
  "model": "CU9",
  "hardware_versions": [
    "unspecified"
  ],
  "firmware_range": {
    "min": null,
    "max": null
  },
  "profile_version": 1,
  "profile_hash": "23017767a8084be5130b749b698b362c6bed72bd0a4ebf3d509ea9df02f9c4c0",
  "last_updated": "2026-10-28",
  "status": "community",
  "oui_prefixes": [],
  "http_fingerprints": [],
  "default_gateway_paths": [
    "/"
  ],
  "driver_type": "web",
  "admin_url": "http://{gateway}/",
  "login_method": "form login",
  "ports": [
    80,
    443
  ],
  "default_credentials_ref": "Vendor factory defaults — see vendor manual",
  "supported_controls": [],
  "unsupported_controls": [
    "router_info",
    "wifi_ssid_24",
    "wifi_ssid_5",
    "wifi_password",
    "wifi_band_enable",
    "guest_wifi",
    "connected_devices",
    "device_block",
    "reboot",
    "wifi_channel",
    "wifi_security_view",
    "admin_password",
    "firmware_check"
  ],
  "tested_on": "",
  "tested_by": "",
  "test_result": {
    "driver": "pending",
    "controls": "not_tested"
  },
  "known_issues": [
    "Registration-only entry. The model is known to the Library, but its driver is still pending, so no controls are available yet.",
    "Rebrand — manufacturer proven, admin surface unproven. Display brand/model Data-Alliance CU9; manufacturer Loopcomm LP-9287 (DeviWiki live).",
    "Source: DeviWiki live (deviwiki.com Special:Ask, fetched 2026-10-28); year: 2009"
  ],
  "signature": "77TP/BDgXRlnrJNwoANKGxSrgKYnS/kNGe/8MpLPqmJTzX9ugT0AMsk1HLSrPvg7rmzIXIhFjstI1DXAyYZ8DQ=="
}
