{
  "profile_id": "abocom_wr5506",
  "brand": "AboCom",
  "model": "WR5506",
  "hardware_versions": [
    "unspecified"
  ],
  "firmware_range": {
    "min": null,
    "max": null
  },
  "profile_version": 1,
  "profile_hash": "199a4c43e38eee989bf675a96b46b8653770b7569f2d39a74ee7c4c80e7417ae",
  "last_updated": "2026-10-28",
  "status": "community",
  "oui_prefixes": [
    "50:67:f0"
  ],
  "http_fingerprints": [],
  "default_gateway_paths": [
    "/"
  ],
  "driver_type": "web",
  "admin_url": "http://{gateway}/",
  "login_method": "form login",
  "ports": [
    80,
    443
  ],
  "default_credentials_ref": "Vendor factory defaults — see vendor manual",
  "supported_controls": [],
  "unsupported_controls": [
    "router_info",
    "wifi_ssid_24",
    "wifi_ssid_5",
    "wifi_password",
    "wifi_band_enable",
    "guest_wifi",
    "connected_devices",
    "device_block",
    "reboot",
    "wifi_channel",
    "wifi_security_view",
    "admin_password",
    "firmware_check"
  ],
  "tested_on": "",
  "tested_by": "",
  "test_result": {
    "driver": "pending",
    "controls": "not_tested"
  },
  "known_issues": [
    "Registration-only entry. The model is known to the Library, but its driver is still pending, so no controls are available yet.",
    "Source: WikiDevi 2019 snapshot — back-catalog data, stale for post-2019 models, verify before any driver work",
    "DeviWiki live: brand/model from page title (category: wireless); manufacturer unproven (no manufacturer property).",
    "Source: DeviWiki live (deviwiki.com Special:Ask, fetched 2026-10-28). FCC ID: MQ4WR5506; year: 2009; CPU: RTL8196BU; Wi-Fi chip: RTL8192SE",
    "Source: DeviWiki live (deviwiki.com Special:Ask, fetched 2026-10-28). FCC ID: I88X150N; year: 2010; CPU: RTL8196BU; Wi-Fi chip: RTL8191RE"
  ],
  "signature": "on7WQjF8EW34psyW5l6pAmVA4Eg8lUcDIrRjpMr4OqJho42yzCdHAJmWCJRZ5YTFUzAoCVhofngYAjfZJEXnBw=="
}
