{
  "profile_id": "d_link_dsl_2500u_bru",
  "brand": "D-Link",
  "model": "DSL-2500U/BRU",
  "hardware_versions": [
    "C1"
  ],
  "firmware_range": {
    "min": null,
    "max": null
  },
  "profile_version": 1,
  "profile_hash": "fb1e0984ed5c324a50a38c655d8e4bdf075b99651d005c634e12a094052a281a",
  "last_updated": "2026-10-28",
  "status": "community",
  "oui_prefixes": [
    "00:05:5d",
    "00:15:e9",
    "00:19:5b",
    "14:d6:4d",
    "1c:7e:e5",
    "f0:7d:68"
  ],
  "http_fingerprints": [],
  "default_gateway_paths": [
    "/"
  ],
  "driver_type": "web",
  "admin_url": "http://{gateway}/",
  "login_method": "form login",
  "ports": [
    80,
    443
  ],
  "default_credentials_ref": "Vendor factory defaults — see vendor manual",
  "supported_controls": [],
  "unsupported_controls": [
    "router_info",
    "wifi_ssid_24",
    "wifi_ssid_5",
    "wifi_password",
    "wifi_band_enable",
    "guest_wifi",
    "connected_devices",
    "device_block",
    "reboot",
    "wifi_channel",
    "wifi_security_view",
    "admin_password",
    "firmware_check"
  ],
  "tested_on": "",
  "tested_by": "",
  "test_result": {
    "driver": "pending",
    "controls": "not_tested"
  },
  "known_issues": [
    "Registration-only entry. The model is known to the Library, but its driver is still pending, so no controls are available yet.",
    "Source: WikiDevi 2019 snapshot — back-catalog data, stale for post-2019 models, verify before any driver work"
  ],
  "signature": "tQiskmj8k9roLI6+kmjFzQbKRABQ2UaSACOZDjM2TtFalaelr3y0MduV2be3tMBVVyqeYqRM5xkjipKh+muKDg=="
}
