{
  "profile_id": "zte_zxdsl_831cii",
  "brand": "ZTE",
  "model": "ZXDSL 831CII",
  "hardware_versions": [
    "unspecified"
  ],
  "firmware_range": {
    "min": null,
    "max": null
  },
  "profile_version": 1,
  "profile_hash": "7f86b0bb5f5ac76eee682e97c72668dc77f568c483e2a9ce985381968b2a01c6",
  "last_updated": "2026-10-28",
  "status": "community",
  "oui_prefixes": [
    "fc:c8:97"
  ],
  "http_fingerprints": [],
  "default_gateway_paths": [
    "/"
  ],
  "driver_type": "web",
  "admin_url": "http://{gateway}/",
  "login_method": "form login",
  "ports": [
    80,
    443
  ],
  "default_credentials_ref": "Vendor factory defaults — see vendor manual",
  "supported_controls": [],
  "unsupported_controls": [
    "router_info",
    "wifi_ssid_24",
    "wifi_ssid_5",
    "wifi_password",
    "wifi_band_enable",
    "guest_wifi",
    "connected_devices",
    "device_block",
    "reboot",
    "wifi_channel",
    "wifi_security_view",
    "admin_password",
    "firmware_check"
  ],
  "tested_on": "",
  "tested_by": "",
  "test_result": {
    "driver": "pending",
    "controls": "not_tested"
  },
  "known_issues": [
    "Registration-only entry. The model is known to the Library, but its driver is still pending, so no controls are available yet.",
    "DeviWiki live: brand/model from page title (category: wired); manufacturer on page: DareGlobal; Manuf product model not stated.",
    "Source: DeviWiki live (deviwiki.com Special:Ask, fetched 2026-10-28); year: 2010; CPU: TC3162U"
  ],
  "signature": "tO9zntV0Ez2Y8ETc5L0ojCQFaqNXLO+yLw+KvnVQFChxkgjVIwZS5D9TLb8vx3scujIa5g6Pw6IT8XTtktJ2Cw=="
}
