{
  "profile_id": "vodafone_dsl_easybox_802",
  "brand": "Vodafone",
  "model": "DSL-EasyBox 802",
  "hardware_versions": [
    "unspecified"
  ],
  "firmware_range": {
    "min": null,
    "max": null
  },
  "profile_version": 1,
  "profile_hash": "e456a0078b593d6cfdc027310854bbf3e2990a0b730bc468686d822186823147",
  "last_updated": "2026-10-28",
  "status": "community",
  "oui_prefixes": [],
  "http_fingerprints": [],
  "default_gateway_paths": [
    "/"
  ],
  "driver_type": "web",
  "admin_url": "http://{gateway}/",
  "login_method": "form login",
  "ports": [
    80,
    443
  ],
  "default_credentials_ref": "Vendor factory defaults — see vendor manual",
  "supported_controls": [],
  "unsupported_controls": [
    "router_info",
    "wifi_ssid_24",
    "wifi_ssid_5",
    "wifi_password",
    "wifi_band_enable",
    "guest_wifi",
    "connected_devices",
    "device_block",
    "reboot",
    "wifi_channel",
    "wifi_security_view",
    "admin_password",
    "firmware_check"
  ],
  "tested_on": "",
  "tested_by": "",
  "test_result": {
    "driver": "pending",
    "controls": "not_tested"
  },
  "known_issues": [
    "Registration-only entry. The model is known to the Library, but its driver is still pending, so no controls are available yet.",
    "Source: WikiDevi 2019 snapshot — back-catalog data, stale for post-2019 models, verify before any driver work",
    "Rebrand — manufacturer proven, admin surface unproven. Display brand/model Vodafone DSL-EasyBox 802; manufacturer Arcadyan ARV752DPW (DeviWiki live).",
    "Source: DeviWiki live (deviwiki.com Special:Ask, fetched 2026-10-28); CPU: PSB 50702; Wi-Fi chip: RT2860"
  ],
  "signature": "ldY3LVnjs9rMK4OOsJGuahgaDp/fIj2GV0Ul364jpa7IVa4yKyD6eQse/r5A6P06U8KFQb6b4iVqfO0LWrpQAw=="
}
